{
  "sistema": "ERP Pedidos (legado GeneXus)",
  "capturado_em": "2026-07-29T14:30:00-03:00",
  "ambiente": "homologacao",
  "design_system": {
    "tokens": {
      "cor_primaria": "#1F4E79",
      "fonte_base": "Tahoma 11px"
    },
    "componentes_recorrentes": ["grid paginado com filtro no header", "botoeira Salvar/Cancelar no rodapé"]
  },
  "telas": [
    {
      "id": "TEL-0032",
      "rota": "/pedidos/novo",
      "titulo": "Novo Pedido",
      "programa_provavel": "PPedidoNovo",
      "screenshot": "capturas/TEL-0032.png",
      "campos": [
        {
          "nome": "cliente_id",
          "tipo": "inteiro",
          "rotulo_ui": "Código do Cliente",
          "nome_fonte": "PedClienteId",
          "obrigatorio": true
        },
        {
          "nome": "data_entrega",
          "tipo": "data",
          "rotulo_ui": "Data de entrega",
          "nome_fonte": "PedDtaEntrega",
          "obrigatorio": false,
          "regra_visivel": "não permite data retroativa"
        },
        {
          "nome": "grid_itens.quantidade",
          "tipo": "grid_column",
          "rotulo_ui": "Qtd",
          "nome_fonte": "GridItens.PedItemQtd"
        }
      ],
      "acoes": [
        {
          "nome": "Salvar",
          "tipo": "escrita",
          "rotulo_ui": "Salvar",
          "nome_fonte": "BtnSalvar"
        },
        {
          "nome": "Cancelar",
          "tipo": "navegacao",
          "rotulo_ui": "Cancelar",
          "nome_fonte": "BtnCancelar",
          "destino": "TEL-0010"
        }
      ],
      "arestas": [
        { "para": "TEL-0033", "gatilho": "Salvar com sucesso" }
      ],
      "casos_replay": [
        {
          "id": "TC-TEL-0032-01",
          "entrada": { "cliente_id": 4471, "data_entrega": "2026-08-10" },
          "saida_legado": { "tela_seguinte": "TEL-0033", "mensagem": "Pedido 88213 criado", "pedido_id": 88213 },
          "capturado_em": "2026-07-29T14:02:00-03:00"
        },
        {
          "id": "TC-TEL-0032-02",
          "entrada": { "cliente_id": 4471, "data_entrega": "2026-07-01" },
          "saida_legado": { "tela_seguinte": "TEL-0032", "mensagem": "Data de entrega não pode ser retroativa", "pedido_id": null },
          "capturado_em": "2026-07-29T14:05:00-03:00"
        }
      ]
    },
    {
      "id": "TEL-0033",
      "rota": "/pedidos/confirmacao",
      "titulo": "Pedido criado",
      "programa_provavel": "PPedidoConfirma",
      "screenshot": "capturas/TEL-0033.png",
      "campos": [],
      "acoes": [
        {
          "nome": "Voltar à lista",
          "tipo": "navegacao",
          "rotulo_ui": "Voltar à lista",
          "destino": "TEL-0010"
        },
        {
          "nome": "Imprimir",
          "tipo": "exportacao",
          "rotulo_ui": "Imprimir"
        }
      ],
      "arestas": []
    }
  ]
}
